{
  "schema_version": 2,
  "source": {
    "name": "Polyglot Voice pluggable registry",
    "note": "Languages and use cases are plug-in rows. Markdown packs are content. SKILL.md routes via this file."
  },
  "languages": [
    {
      "id": "english",
      "iso": "en",
      "name": "English",
      "aliases": [
        "en",
        "US English",
        "Indo-US",
        "American English"
      ],
      "umbrella": false,
      "support": {
        "status": "validated",
        "pack": "references/languages/english/pack.md"
      },
      "registers": [
        "baku",
        "profesional",
        "santai"
      ],
      "speech_levels": [],
      "overlays": [
        {
          "id": "us",
          "type": "regional",
          "status": "validated",
          "file": "references/languages/english/overlays/us.md"
        },
        {
          "id": "uk",
          "type": "regional",
          "status": "validated",
          "file": "references/languages/english/overlays/uk.md"
        },
        {
          "id": "au",
          "type": "regional",
          "status": "validated",
          "file": "references/languages/english/overlays/au.md"
        },
        {
          "id": "nz",
          "type": "regional",
          "status": "validated",
          "file": "references/languages/english/overlays/nz.md"
        },
        {
          "id": "ca",
          "type": "regional",
          "status": "validated",
          "file": "references/languages/english/overlays/ca.md"
        },
        {
          "id": "ie",
          "type": "regional",
          "status": "validated",
          "file": "references/languages/english/overlays/ie.md"
        },
        {
          "id": "za",
          "type": "regional",
          "status": "validated",
          "file": "references/languages/english/overlays/za.md"
        },
        {
          "id": "in-en",
          "type": "regional",
          "status": "validated",
          "file": "references/languages/english/overlays/in-en.md"
        },
        {
          "id": "ph-en",
          "type": "regional",
          "status": "validated",
          "file": "references/languages/english/overlays/ph-en.md"
        },
        {
          "id": "us-slang",
          "type": "slang",
          "status": "validated",
          "file": "references/languages/english/overlays/us-slang.md"
        },
        {
          "id": "singlish",
          "type": "mix",
          "status": "validated",
          "file": "references/languages/english/overlays/singlish.md"
        },
        {
          "id": "jaksel",
          "type": "mix",
          "status": "validated",
          "file": "references/languages/english/overlays/jaksel.md"
        }
      ]
    },
    {
      "id": "indonesia",
      "iso": "id",
      "name": "Bahasa Indonesia",
      "aliases": [
        "Indonesian",
        "id",
        "bahasa",
        "ID"
      ],
      "umbrella": false,
      "support": {
        "status": "validated",
        "pack": "references/languages/indonesia/pack.md"
      },
      "registers": [
        "baku",
        "profesional",
        "santai"
      ],
      "speech_levels": [],
      "overlays": [
        {
          "id": "jakarta",
          "type": "regional",
          "status": "validated",
          "file": "references/languages/indonesia/overlays/jakarta.md"
        },
        {
          "id": "bandung",
          "type": "regional",
          "status": "validated",
          "file": "references/languages/indonesia/overlays/bandung.md"
        },
        {
          "id": "surabaya",
          "type": "regional",
          "status": "validated",
          "file": "references/languages/indonesia/overlays/surabaya.md"
        },
        {
          "id": "yogyakarta",
          "type": "regional",
          "status": "validated",
          "file": "references/languages/indonesia/overlays/yogyakarta.md"
        },
        {
          "id": "medan",
          "type": "regional",
          "status": "validated",
          "file": "references/languages/indonesia/overlays/medan.md"
        },
        {
          "id": "makassar",
          "type": "regional",
          "status": "validated",
          "file": "references/languages/indonesia/overlays/makassar.md"
        },
        {
          "id": "jaksel",
          "type": "mix",
          "status": "validated",
          "file": "references/languages/indonesia/overlays/jaksel.md"
        }
      ]
    },
    {
      "id": "malay",
      "iso": "ms",
      "name": "Malay",
      "aliases": [
        "Malaysian Malay",
        "bahasa Melayu",
        "Melayu"
      ],
      "umbrella": false,
      "support": {
        "status": "validated",
        "pack": "references/languages/malay/pack.md"
      },
      "registers": [
        "baku",
        "profesional",
        "santai"
      ],
      "speech_levels": [],
      "overlays": [
        {
          "id": "manglish",
          "type": "mix",
          "status": "validated",
          "file": "references/languages/malay/overlays/manglish.md"
        },
        {
          "id": "ms-my",
          "type": "regional",
          "status": "validated",
          "file": "references/languages/malay/overlays/ms-my.md"
        },
        {
          "id": "ms-bn",
          "type": "regional",
          "status": "validated",
          "file": "references/languages/malay/overlays/ms-bn.md"
        },
        {
          "id": "ms-sg",
          "type": "regional",
          "status": "validated",
          "file": "references/languages/malay/overlays/ms-sg.md"
        }
      ]
    },
    {
      "id": "jawa",
      "iso": "jv",
      "name": "Jawa",
      "aliases": [
        "Javanese",
        "bahasa Jawa"
      ],
      "umbrella": false,
      "support": {
        "status": "validated",
        "pack": "references/languages/jawa/pack.md"
      },
      "registers": [
        "baku",
        "profesional",
        "santai"
      ],
      "speech_levels": [
        "ngoko",
        "madya",
        "krama"
      ],
      "overlays": [
        {
          "id": "jv-solo",
          "type": "regional",
          "status": "validated",
          "file": "references/languages/jawa/overlays/jv-solo.md"
        },
        {
          "id": "jv-timur",
          "type": "regional",
          "status": "validated",
          "file": "references/languages/jawa/overlays/jv-timur.md"
        }
      ]
    },
    {
      "id": "sunda",
      "iso": "su",
      "name": "Sunda",
      "aliases": [
        "Sundanese",
        "bahasa Sunda"
      ],
      "umbrella": false,
      "support": {
        "status": "validated",
        "pack": "references/languages/sunda/pack.md"
      },
      "registers": [
        "baku",
        "profesional",
        "santai"
      ],
      "speech_levels": [
        "loma",
        "cohag"
      ],
      "overlays": [
        {
          "id": "su-bandung",
          "type": "regional",
          "status": "validated",
          "file": "references/languages/sunda/overlays/su-bandung.md"
        },
        {
          "id": "su-cirebon",
          "type": "regional",
          "status": "validated",
          "file": "references/languages/sunda/overlays/su-cirebon.md"
        }
      ]
    },
    {
      "id": "bali",
      "iso": "ban",
      "name": "Balinese",
      "aliases": [
        "bahasa Bali",
        "Bali"
      ],
      "umbrella": false,
      "support": {
        "status": "validated",
        "pack": "references/languages/bali/pack.md"
      },
      "registers": [
        "baku",
        "profesional",
        "santai"
      ],
      "speech_levels": [
        "alus",
        "madia",
        "kasar"
      ],
      "overlays": [
        {
          "id": "bali-urban",
          "type": "regional",
          "status": "validated",
          "file": "references/languages/bali/overlays/bali-urban.md"
        },
        {
          "id": "bali-highland",
          "type": "regional",
          "status": "validated",
          "file": "references/languages/bali/overlays/bali-highland.md"
        }
      ]
    },
    {
      "id": "mandarin",
      "iso": "zh",
      "name": "Mandarin Chinese",
      "aliases": [
        "zh",
        "中文",
        "Chinese",
        "Mandarin"
      ],
      "umbrella": false,
      "support": {
        "status": "validated",
        "pack": "references/languages/mandarin/pack.md"
      },
      "registers": [
        "baku",
        "profesional",
        "santai"
      ],
      "speech_levels": [],
      "overlays": [
        {
          "id": "zh-cn",
          "type": "regional",
          "status": "validated",
          "file": "references/languages/mandarin/overlays/zh-cn.md"
        },
        {
          "id": "zh-tw",
          "type": "regional",
          "status": "validated",
          "file": "references/languages/mandarin/overlays/zh-tw.md"
        },
        {
          "id": "zh-sg",
          "type": "regional",
          "status": "validated",
          "file": "references/languages/mandarin/overlays/zh-sg.md"
        },
        {
          "id": "zh-hk",
          "type": "regional",
          "status": "validated",
          "file": "references/languages/mandarin/overlays/zh-hk.md"
        }
      ]
    },
    {
      "id": "hindi",
      "iso": "hi",
      "name": "Hindi",
      "aliases": [
        "hi",
        "हिन्दी"
      ],
      "umbrella": false,
      "support": {
        "status": "validated",
        "pack": "references/languages/hindi/pack.md"
      },
      "registers": [
        "baku",
        "profesional",
        "santai"
      ],
      "speech_levels": [],
      "overlays": [
        {
          "id": "hinglish",
          "type": "mix",
          "status": "validated",
          "file": "references/languages/hindi/overlays/hinglish.md"
        },
        {
          "id": "hi-standard",
          "type": "regional",